{
  "dict": "PW",
  "generated": "2026-07-24",
  "source": {
    "crosscheck_tsv": "scripts/out/pw_pref_abbr_crosscheck.tsv",
    "decompose_tsv": "scripts/out/pw_pref_only_decompose.tsv"
  },
  "n": 302,
  "rows": [
    {
      "dict": "PW",
      "key": "AK.",
      "expansion": "Amarakoça, Ausg. von Loiseleur Deslongchamps.",
      "class": "work",
      "body_count": 1478,
      "residual_class": null,
      "work_id": "prov:PW:AK.",
      "review_required": true,
      "sources": "pwpref03.md:30",
      "fold_applied": null
    },
    {
      "dict": "PW",
      "key": "AV.",
      "expansion": "Atharvaveda, Ausg. von Roth und Whitney (Roth).",
      "class": "work",
      "body_count": 2084,
      "residual_class": null,
      "work_id": "prov:PW:AV.",
      "review_required": true,
      "sources": "pwpref03.md:54",
      "fold_applied": null
    },
    {
      "dict": "PW",
      "key": "AV. Jyot.",
      "expansion": "Ǵjotisha zum AV., Hdschr. (Roth).",
      "class": "work",
      "body_count": 9,
      "residual_class": null,
      "work_id": "prov:PW:AV._Jyot.",
      "review_required": true,
      "sources": "pwpref03.md:56",
      "fold_applied": null
    },
    {
      "dict": "PW",
      "key": "AV. Paipp.",
      "expansion": "AV. der Paippalâda-Schule, Hdschr. (Roth).",
      "class": "work",
      "body_count": 72,
      "residual_class": null,
      "work_id": "prov:PW:AV._Paipp.",
      "review_required": true,
      "sources": "pwpref03.md:58",
      "fold_applied": null
    },
    {
      "dict": "PW",
      "key": "AV. Pariś.",
      "expansion": "Pariçishṭa zum AV., Hdschr. (Roth).",
      "class": "work",
      "body_count": 54,
      "residual_class": null,
      "work_id": "prov:PW:AV._Pari_.",
      "review_required": true,
      "sources": "pwpref03.md:60",
      "fold_applied": null
    },
    {
      "dict": "PW",
      "key": "AV. Prâjaçḱ.",
      "expansion": "Prâjaçḱitta zum AV., Hdschr. (Roth).",
      "class": "work",
      "body_count": 0,
      "residual_class": "rare",
      "work_id": "prov:PW:AV._Pr_ja_.",
      "review_required": true,
      "sources": "pwpref03.md:62",
      "fold_applied": null
    },
    {
      "dict": "PW",
      "key": "Agni-P.",
      "expansion": "Agnipurâṇa in der Bibl. ind.",
      "class": "work",
      "body_count": 212,
      "residual_class": null,
      "work_id": "prov:PW:Agni-P.",
      "review_required": true,
      "sources": "pwpref03.md:22",
      "fold_applied": null
    },
    {
      "dict": "PW",
      "key": "Ait. Br.",
      "expansion": "Aitarejabrâhmaṇa, Ausg. von Haug.",
      "class": "work",
      "body_count": 273,
      "residual_class": null,
      "work_id": "prov:PW:Ait._Br.",
      "review_required": true,
      "sources": "pwpref03.md:26",
      "fold_applied": null
    },
    {
      "dict": "PW",
      "key": "Ait. Up.",
      "expansion": "Aitarejopanishad in der Bibl. ind.",
      "class": "work",
      "body_count": 10,
      "residual_class": null,
      "work_id": "prov:PW:Ait._Up.",
      "review_required": true,
      "sources": "pwpref03.md:28",
      "fold_applied": null
    },
    {
      "dict": "PW",
      "key": "Ait. Âr.",
      "expansion": "Aitarejâranjaka in der Bibl. ind. In der Regel citirt nach Seite und Zeile (Kern und Roth).",
      "class": "work",
      "body_count": 190,
      "residual_class": null,
      "work_id": "prov:PW:Ait._r.",
      "review_required": true,
      "sources": "pwpref03.md:24",
      "fold_applied": null
    },
    {
      "dict": "PW",
      "key": "Amṛt. Up.",
      "expansion": "Amṛtabindûpanishad in der Bibl. ind. (Geldner und Roth).",
      "class": "work",
      "body_count": 16,
      "residual_class": null,
      "work_id": "prov:PW:Am_t._Up.",
      "review_required": true,
      "sources": "pwpref03.md:34",
      "fold_applied": null
    },
    {
      "dict": "PW",
      "key": "Anukram. zu RV.",
      "expansion": "Anukramaṇikâ zu RV. im Comm. Sâjaṇa's.",
      "class": "work",
      "body_count": 0,
      "residual_class": "ambiguous",
      "work_id": "prov:PW:Anukram._zu_RV.",
      "review_required": true,
      "sources": "pwpref03.md:38",
      "fold_applied": null
    },
    {
      "dict": "PW",
      "key": "B. A. J.",
      "expansion": "Bombay Asiatic Journal (Geldner).",
      "class": "work",
      "body_count": 107,
      "residual_class": null,
      "work_id": "prov:PW:B._A._J.",
      "review_required": true,
      "sources": "pwpref03.md:66",
      "fold_applied": null
    },
    {
      "dict": "PW",
      "key": "Beitr. z. K. d. ig. Spr.",
      "expansion": "Beiträge zur Kunde der indogermanischen Sprachen.",
      "class": "work",
      "body_count": 1,
      "residual_class": null,
      "work_id": "prov:PW:Beitr._z._K._d._ig._Spr.",
      "review_required": true,
      "sources": "pwpref03.md:70",
      "fold_applied": null
    },
    {
      "dict": "PW",
      "key": "Benf. Chr.",
      "expansion": "Benfey's Chrestomathie.",
      "class": "work",
      "body_count": 21,
      "residual_class": null,
      "work_id": "prov:PW:Benf._Chr.",
      "review_required": true,
      "sources": "pwpref03.md:72",
      "fold_applied": null
    },
    {
      "dict": "PW",
      "key": "Bhag.",
      "expansion": "Bhagavadgîtâ, Ausg. von Schlegel.",
      "class": "work",
      "body_count": 1175,
      "residual_class": null,
      "work_id": "prov:PW:Bhag.",
      "review_required": true,
      "sources": "pwpref03.md:74",
      "fold_applied": null
    },
    {
      "dict": "PW",
      "key": "Bhar. Nâṭyaś.",
      "expansion": "Bhâratîjanâṭjaçâstra am Schluss von Daçar. in der Bibl. ind.",
      "class": "work",
      "body_count": 43,
      "residual_class": null,
      "work_id": "prov:PW:Bhar._N_ya_.",
      "review_required": true,
      "sources": "pwpref03.md:78",
      "fold_applied": null
    },
    {
      "dict": "PW",
      "key": "Bhavishjott. P.",
      "expansion": "Bhavishjottarapurâṇa nach Citaten in andern Werken.",
      "class": "work",
      "body_count": 0,
      "residual_class": "ortho",
      "work_id": "prov:PW:Bhavishjott._P.",
      "review_required": true,
      "sources": "pwpref03.md:86",
      "fold_applied": null
    },
    {
      "dict": "PW",
      "key": "Bhaṭṭ.",
      "expansion": "Bhaṭṭikâvja, Calcutta 1828.",
      "class": "work",
      "body_count": 396,
      "residual_class": null,
      "work_id": "prov:PW:Bha_.",
      "review_required": true,
      "sources": "pwpref03.md:82",
      "fold_applied": null
    },
    {
      "dict": "PW",
      "key": "Bhoja-Pr.",
      "expansion": "Bhoǵaprabandha, Benares 1925 (Kern).",
      "class": "work",
      "body_count": 29,
      "residual_class": null,
      "work_id": "prov:PW:Bhoja-Pr.",
      "review_required": true,
      "sources": "pwpref03.md:90",
      "fold_applied": null
    },
    {
      "dict": "PW",
      "key": "Bhoǵa-Ḱar.",
      "expansion": "Bhoǵakaritra, Madras 1862 (Stenzler).",
      "class": "work",
      "body_count": 0,
      "residual_class": "ocr_key",
      "work_id": "prov:PW:Bho_a-_ar.",
      "review_required": true,
      "sources": "pwpref03.md:88",
      "fold_applied": null
    },
    {
      "dict": "PW",
      "key": "Bhâg. P.",
      "expansion": "Bhâgavatapurâṇa. Die 9 ersten Skandha nach Burnouf's Ausgabe, wenn nicht ausdrücklich ed. Bomb. hinzugefügt wird; die letzten Skandha nach der ed. Bomb. In Klammern eingeschlossene Zahlen verweisen au",
      "class": "work",
      "body_count": 1059,
      "residual_class": null,
      "work_id": "prov:PW:Bh_g._P.",
      "review_required": true,
      "sources": "pwpref03.md:76",
      "fold_applied": null
    },
    {
      "dict": "PW",
      "key": "Bhâshâp.",
      "expansion": "Bhâshâpariḱḱheda in der Bibl. ind.",
      "class": "work",
      "body_count": 0,
      "residual_class": "true_unused",
      "work_id": "prov:PW:Bh_sh_p.",
      "review_required": true,
      "sources": "pwpref03.md:80",
      "fold_applied": null
    },
    {
      "dict": "PW",
      "key": "Bhâvapr.",
      "expansion": "Bhâvapraḱâça, Calcutta 1875 und Hdschr. (Roth).",
      "class": "work",
      "body_count": 1697,
      "residual_class": null,
      "work_id": "prov:PW:Bh_vapr.",
      "review_required": true,
      "sources": "pwpref03.md:84",
      "fold_applied": null
    },
    {
      "dict": "PW",
      "key": "Bibl. ind.",
      "expansion": "Bibliotheca indica.",
      "class": "work",
      "body_count": 13,
      "residual_class": null,
      "work_id": "prov:PW:Bibl._ind.",
      "review_required": true,
      "sources": "pwpref03.md:92",
      "fold_applied": null
    },
    {
      "dict": "PW",
      "key": "Brahma-P.",
      "expansion": "Brahmapurâṇa nach Citaten in verschiedenen Werken.",
      "class": "work",
      "body_count": 4,
      "residual_class": null,
      "work_id": "prov:PW:Brahma-P.",
      "review_required": true,
      "sources": "pwpref03.md:98",
      "fold_applied": null
    },
    {
      "dict": "PW",
      "key": "Brahmabindûp.",
      "expansion": "Brahmabindûpanishad in der Bibl. ind. (Geldner und Roth).",
      "class": "work",
      "body_count": 7,
      "residual_class": null,
      "work_id": "prov:PW:Brahmabind_p.",
      "review_required": true,
      "sources": "pwpref03.md:96",
      "fold_applied": null
    },
    {
      "dict": "PW",
      "key": "Brahmop.",
      "expansion": "Brahmopanishad in der Bibl. ind. (Geldner und Roth).",
      "class": "work",
      "body_count": 7,
      "residual_class": null,
      "work_id": "prov:PW:Brahmop.",
      "review_required": true,
      "sources": "pwpref03.md:100",
      "fold_applied": null
    },
    {
      "dict": "PW",
      "key": "Burn. Intr.",
      "expansion": "Burnouf, Introduction à l'histoire du Buddhisme indien.",
      "class": "work",
      "body_count": 1,
      "residual_class": null,
      "work_id": "prov:PW:Burn._Intr.",
      "review_required": true,